Advisory Topic,Standardized Cancer Type,Source URL,Scrape Date,Content Hash,Intro Summary,Full Context Block,Advisory Topic_en,Intro Summary_en,Full Context Block_en,trustworthiness
Veelbelovende zorg - Gepersonaliseerde behandeling met selectieve interne radiotherapie bij oudere of kwetsbare darmkankerpatiënten met uitzaaiingen die zich beperken tot de lever,Darmkanker (Colorectal),https://www.zorginstituutnederland.nl/werkagenda/kanker/veelbelovende-zorg-gepersonaliseerde-behandeling-met-selectieve-interne-radiotherapie-bij-oudere-of-kwetsbare-darmkankerpatienten-met-uitzaaiingen-die-zich-beperken-tot-de-lever,2026-05-31 14:46:33,c229cd620d9320ed2988201c1b628a306ea22b036b42e5e92e3ef72f073266a7,"Via de subsidieregeling Veelbelovende zorg wordt onderzoek gesubsidieerd naar de (kosten)effectiviteit van een eenmalige gepersonaliseerde behandeling met selectieve interne radiotherapie (SIRT), bij oudere of kwetsbare patiënten met nog niet eerder behandelde, niet-resectabele colorectale metastasen die zich beperken tot de lever. Het project is gestart op 1 juli 2021 voor een periode van 5 jaar. Na afronding van het project worden de onderzoeksresultaten rond juni 2026 ingediend bij het Zorginstituut. Wij gebruiken deze onderzoeksgegevens om te beoordelen of de behandeling voor deze patiëntgroep uit het basispakket van de zorgverzekering kan worden vergoed.","Via de subsidieregeling Veelbelovende zorg wordt onderzoek gesubsidieerd naar de (kosten)effectiviteit van een eenmalige gepersonaliseerde behandeling met selectieve interne radiotherapie (SIRT), bij oudere of kwetsbare patiënten met nog niet eerder behandelde, niet-resectabele colorectale metastasen die zich beperken tot de lever. Het project is gestart op 1 juli 2021 voor een periode van 5 jaar. Na afronding van het project worden de onderzoeksresultaten rond juni 2026 ingediend bij het Zorginstituut. Wij gebruiken deze onderzoeksgegevens om te beoordelen of de behandeling voor deze patiëntgroep uit het basispakket van de zorgverzekering kan worden vergoed.
De aandoening en behandeling
Voor oudere of kwetsbare patiënten met uitzaaiingen van dikke darmkanker die zich beperken tot de lever en die niet operatief niet behandeld kunnen worden, bestaat de standaardbehandeling uit driewekelijkse kuren met capecitabine en bevacizumab. Deze behandeling is vaak belastend voor patiënten als gevolg van de regelmatige ziekenhuishuisbezoeken en mogelijk optreden van bijwerkingen.
Een mogelijk minder belastend alternatief is een eenmalige gepersonaliseerde behandeling met SIRT. Bij deze behandeling worden via een katheter radioactieve bolletjes in de hoofdslagader van de lever ingebracht, met als doel de tumoren te vernietigen.
Het onderzoek
Het onderzoek betreft een multicenter, gerandomiseerd onderzoek, waarin de (kosten)effectiviteit van een eenmalige gepersonaliseerde radioembolisatiebehandeling wordt vergeleken met driewekelijkse kuren met capecitabine en bevacizumab. Aan het onderzoek zullen 220 oudere en/of kwetsbare patiënten deelnemen met nog niet eerder behandelde, niet-resectabele colorectale metastasen die zich beperken tot de lever.
De helft van de patiënten wordt behandeld met de radioembolisatie en de andere helft met de standaardbehandeling. Het doel van dit onderzoek is om te bepalen of een eenmalige, gepersonaliseerde behandeling met SIRT een vergelijkbare effectiviteit heeft met de huidige standaardtherapie bij deze patiëntgroep. De hypothese is dat het risico op progressie vergelijkbaar zal zijn, maar dat de kwaliteit van leven bij behandeling met SIRT (gemeten met de EORTC-QLQ) gemiddeld 10 punten hoger zal zijn dan bij de standaardbehandeling. Ook wordt gekeken naar de positieve effecten van de radioembolisatie behandeling op andere uitkomstmaten, en of de behandeling veilig en kosteneffectief is.
Het onderzoek wordt geleid door Universitair Medisch Centrum Utrecht.
Beoordeling stand van de wetenschap en praktijk
Zorg wordt alleen vergoed vanuit het basispakket als die ten minste even effectief is als de gebruikelijke zorg in Nederland. Oftewel de zorg moet voldoen aan de ‘stand van de wetenschap en praktijk. Na het afronden van het onderzoek en het verkrijgen van de onderzoeksresultaten, start het Zorginstituut met de beoordeling.
Op basis van alle gepubliceerde onderzoeksresultaten, beoordeelt het Zorginstituut binnen 6 maanden of een eenmalige gepersonaliseerde behandeling met SIRT bij oudere en/of kwetsbare patiënten met nog niet eerder behandelde, niet-resectabele colorectale metastasen die zich beperken tot de lever, voldoet aan de ‘stand van de wetenschap en praktijk’. Ook beoordeelt het Zorginstituut of de (meer)kosten van de behandeling acceptabel zijn.
Op dit moment voldoet de behandeling nog niet aan de ‘stand van de wetenschap en praktijk’, en mag die nog niet uit het basispakket van de Zvw vergoed worden.
Voor informatie
Vragen kunt u per e-mail stellen aan het Zorginstituut, team Veelbelovende zorg: veelbelovendezorg@zinl.nl .
Planning
Looptijd Veelbelovende zorg-project
juli 2026 – december 2026
Betrokken partijen
Landelijke Werkgroep Neuro-Oncologie (LWNO)
Patiëntenvereniging Hersenletsel.nl
Zorgverzekeraars Nederland (ZN)",Promising care - Personalized treatment with selective internal radiotherapy in elderly or vulnerable colon cancer patients with metastases limited to the liver,"The Promising Care subsidy scheme subsidizes research into the (cost) effectiveness of a one-off personalized treatment with selective internal radiotherapy (SIRT), in older or vulnerable patients with previously untreated, unresectable colorectal metastases that are limited to the liver. The project started on July 1, 2021 for a period of 5 years. After completion of the project, the research results will be submitted to the Healthcare Institute around June 2026. We use this research data to assess whether the treatment for this patient group can be reimbursed from the basic health insurance package.","The Promising Care subsidy scheme subsidizes research into the (cost) effectiveness of a one-off personalized treatment with selective internal radiotherapy (SIRT), in older or vulnerable patients with previously untreated, unresectable colorectal metastases that are limited to the liver. The project started on July 1, 2021 for a period of 5 years. After completion of the project, the research results will be submitted to the Healthcare Institute around June 2026. We use this research data to assess whether the treatment for this patient group can be reimbursed from the basic health insurance package.
The condition and treatment
For older or vulnerable patients with metastases from colon cancer that are limited to the liver and who cannot be treated surgically, the standard treatment consists of three-weekly courses of capecitabine and bevacizumab. This treatment is often stressful for patients due to the regular hospital visits and possible side effects.
A possible less invasive alternative is a one-off personalized treatment with SIRT. In this treatment, radioactive beads are introduced into the main artery of the liver through a catheter, with the aim of destroying the tumors.
The research
The study is a multicenter, randomized study in which the (cost) effectiveness of a one-off personalized radioembolization treatment is compared with three-weekly courses of capecitabine and bevacizumab. The study will involve 220 elderly and/or vulnerable patients with previously untreated, unresectable colorectal metastases limited to the liver.
Half of the patients are treated with radioembolization and the other half with standard treatment. The aim of this study is to determine whether a single, personalized treatment with SIRT has a comparable effectiveness with current standard therapy in this patient group. The hypothesis is that the risk of progression will be similar, but that quality of life with SIRT treatment (measured with the EORTC-QLQ) will be on average 10 points higher than with standard treatment. The positive effects of radioembolization treatment on other outcome measures are also examined, and whether the treatment is safe and cost-effective.
The research is led by University Medical Center Utrecht.
Assessment of the state of science and practice
Care is only reimbursed from the basic package if it is at least as effective as usual care in the Netherlands. In other words, the care must comply with the 'state of science and practice'. After completing the research and obtaining the research results, the Healthcare Institute starts the assessment.
Based on all published research results, the Healthcare Institute will assess within 6 months whether a one-off personalized treatment with SIRT in older and/or vulnerable patients with previously untreated, unresectable colorectal metastases limited to the liver meets the 'state of science and practice'. The Healthcare Institute also assesses whether the (additional) costs of the treatment are acceptable.
At this time, the treatment does not yet meet the 'state of science and practice' and may not yet be reimbursed from the basic Zvw package.
For information
You can ask questions by e-mail to the Zorginstituut, Promising Care team: redactiezorg@zinl.nl.
Planning
Duration Promising healthcare project
July 2026 – December 2026
Parties involved
National Neuro-Oncology Working Group (LWNO)
Patient association Hersenschade.nl
Health insurers Netherlands (ZN)",3.35
Veelbelovende zorg - Op de zorglocatie geproduceerde CAR T-celtherapie bij patiënten met terugkeer van multipel myeloom,Algemeen / Onbekend,https://www.zorginstituutnederland.nl/werkagenda/kanker/veelbelovende-zorg-op-de-zorglocatie-geproduceerde-car-t-celtherapie-bij-patienten-met-terugkeer-van-multipel-myeloom,2026-05-31 14:46:35,f0c80695b6876e885c5e3fe859722da1f55b27ee01600ab3669bd3a49ae05277,Via de Subsidieregeling veelbelovende zorg wordt onderzoek gesubsidieerd naar de (kosten)effectiviteit van op de zorglocatie geproduceerde BCMA-gerichte CAR T-celtherapie. Deze behandeling kan worden gebruikt bij volwassen patiënten met een recidief of refractair multipel myeloom. Het project start op 1 april 2025 voor een periode van 6 jaar. Na afronding van het project worden de onderzoeksresultaten rond april 2031 bij het Zorginstituut ingediend. Het Zorginstituut gebruikt deze onderzoeksgegevens om te beoordelen of deze behandeling bij de genoemde groep patiënten vergoed kan worden uit het basispakket van de zorgverzekering.,"Via de Subsidieregeling veelbelovende zorg wordt onderzoek gesubsidieerd naar de (kosten)effectiviteit van op de zorglocatie geproduceerde BCMA-gerichte CAR T-celtherapie. Deze behandeling kan worden gebruikt bij volwassen patiënten met een recidief of refractair multipel myeloom. Het project start op 1 april 2025 voor een periode van 6 jaar. Na afronding van het project worden de onderzoeksresultaten rond april 2031 bij het Zorginstituut ingediend. Het Zorginstituut gebruikt deze onderzoeksgegevens om te beoordelen of deze behandeling bij de genoemde groep patiënten vergoed kan worden uit het basispakket van de zorgverzekering.
De aandoening en behandeling
Multipel myeloom is een kanker van plasmacellen. Plasmacellen zijn 1 van de soorten afweercellen van het menselijk lichaam. Myeloomcellen is een ander woord voor kwaadaardige plasmacellen. Er vindt bij multipel myeloom ongecontroleerde celdeling plaats van kwaadaardige plasmacellen, op meerdere plekken in het beenmerg. In Nederland wordt deze diagnose jaarlijks bij 1300 patiënten gesteld. In de behandeling zijn de afgelopen jaren grote stappen gezet met verbetering van de prognose, maar helaas komt na verloop van tijd de ziekte weer terug.
CAR T-celtherapie is een innovatieve immuuntherapie die levensreddend kan zijn voor uitbehandelde patiënten met multipel myeloom. Met deze therapie worden de witte bloedlichamen met genetische modificatie omgevormd tot CAR T-cellen. Die kunnen vervolgens kankercellen op basis van het BCMA-kenmerk herkennen, aanvallen en uitschakelen. BCMA staat voor B-cell maturation antigen . De onderzoeksgroep gaat BCMA-gerichte CAR T-cellen in het ziekenhuis produceren zonder de cellen tussendoor in te vriezen. Op de zorglocatie geproduceerde CAR T-cellen worden naar verwachting binnen 8 dagen geproduceerd. Daardoor kunnen ze relatief snel worden toegediend aan de patiënt. Deze behandeling wordt vergeleken met de huidige standaardbehandeling in de derde lijn. Dat is systemische therapie met:
pomalidomide, cyclophosphamide, en dexamethason (PEP);
pomalidomide, bortezomib, en dexamethason (PVd);
carfilzomib en dexamethason (Kd);
elotuzumab, pomalidomide, en dexamethason (EPd); of
daratumumab, carfilzomib, en dexamethason (DKd).
Het onderzoek
Het onderzoek is een multicenter, open-label, gerandomiseerde studie, waarin de (kosten)effectiviteit van op de zorglocatie geproduceerde BCMA-gerichte CAR T-celtherapie wordt vergeleken met die van de huidige standaardbehandeling met systemische therapieën. Systemisch betekent dat de medicijnen overal in het lichaam komen. Aan het onderzoek zullen 126 patiënten deelnemen met recidiverend of refractair multipel myeloom die ten minste 2 systemische therapieën hebben gehad. Recidiverend betekent dat de kanker is teruggekomen, na eerst gedeeltelijk of geheel te zijn verdwenen. En refractair betekent dat de tumor niet op een eerdere behandeling heeft gereageerd. 63 patiënten krijgen op de zorglocatie geproduceerde BCMA-gerichte CAR T-celtherapie.
Het doel van dit onderzoek is om te ontdekken of op deze behandeling bij de genoemde patiënten leidt tot een langere progressievrije overleving, vergeleken met de huidige standaardbehandeling. Progressievrije overleving betekent dat een patiënt met de ziekte leeft, maar dat deze niet erger wordt. De hypothese is dat de gemiddelde progressievrije overleving toeneemt van 9 naar 16 maanden. Ook wordt gekeken naar de effecten van op de zorglocatie geproduceerde BCMA-gerichte CAR T-celtherapie op andere uitkomstmaten, zoals de veiligheid en kosteneffectiviteit.
Het onderzoek wordt geleid door het Universitair Medisch Centrum Groningen (UMCG) in Groningen.
Beoordeling stand van de wetenschap en praktijk
Na het afronden van het onderzoek en het verkrijgen van de onderzoeksresultaten, beoordeelt het Zorginstituut op basis van alle gepubliceerde onderzoeksresultaten binnen 6 maanden of op de zorglocatie geproduceerde BCMA-gerichte CAR T-celtherapie bij patiënten met recidiverend of refractair multipel myeloom voldoet aan de ‘stand van de wetenschap en praktijk’. Ook beoordeelt het Zorginstituut of de (meer)kosten acceptabel zijn.
In dit project wordt onderzoek gedaan naar een Advanced Therapy Medicinal Product (ATMP). Een ATMP is een medicijn gebaseerd op genen, cellen of weefsels. Als het ATMP geen of nog geen handelsvergunning heeft, mogen patiënten na afloop van het onderzoek alleen worden behandeld met een zogenoemde hospital exemption . Dit is een ziekenhuisuitzondering. De Inspectie Gezondheidszorg en Jeugd (IGJ) moet deze eerst goedkeuren. Als de behandeling leidt tot positieve resultaten voor patiënten, moeten subsidieontvangers streven naar registratie van het ATMP.
Op dit moment voldoet op de zorglocatie geproduceerde BCMA-gerichte CAR T-celtherapie bij patiënten met recidiverend of refractair multipel myeloom nog niet aan de ‘stand van de wetenschap en praktijk’. De behandeling mag daarom nog niet worden vergoed uit het basispakket van de zorgverzekering.
Voor informatie
Hebt u vragen? Dan kunt u deze per e-mail stellen aan het Zorginstituut, team Veelbelovende zorg: veelbelovendezorg@zinl.nl .
Planning
Looptijd Veelbelovende zorg-project
april 2031 - september 2031
Betrokken partijen
HOVON
Hematon",Promising Care - Site-of-care CAR T-cell therapy in patients with recurrence of multiple myeloma,"The Promising Care Subsidy Scheme subsidizes research into the (cost) effectiveness of BCMA-targeted CAR T-cell therapy produced at the care location. This treatment can be used in adult patients with relapsed or refractory multiple myeloma. The project will start on April 1, 2025 for a period of 6 years. After completion of the project, the research results will be submitted to the Healthcare Institute around April 2031. The Healthcare Institute uses this research data to assess whether this treatment for the group of patients mentioned can be reimbursed from the basic health insurance package.","The Promising Care Subsidy Scheme subsidizes research into the (cost) effectiveness of BCMA-targeted CAR T-cell therapy produced at the care location. This treatment can be used in adult patients with relapsed or refractory multiple myeloma. The project will start on April 1, 2025 for a period of 6 years. After completion of the project, the research results will be submitted to the Healthcare Institute around April 2031. The Healthcare Institute uses this research data to assess whether this treatment for the group of patients mentioned can be reimbursed from the basic health insurance package. The condition and treatment
Multiple myeloma is a cancer of plasma cells. Plasma cells are one of the types of immune cells in the human body. Myeloma cells is another word for malignant plasma cells. In multiple myeloma, uncontrolled cell division of malignant plasma cells takes place in several places in the bone marrow. In the Netherlands, this diagnosis is made in 1,300 patients every year. Major steps have been taken in treatment in recent years with improvements in the prognosis, but unfortunately the disease returns over time. CAR T-cell therapy is an innovative immunotherapy that can be life-saving for patients with multiple myeloma who have completed treatment. With this therapy, the white blood cells are converted into CAR T cells using genetic modification. These can then recognize, attack and eliminate cancer cells based on the BCMA characteristic. BCMA stands for B-cell maturation antigen. The research group will produce BCMA-targeted CAR T cells in the hospital without freezing the cells in between. CAR T cells produced at the point of care are expected to be produced within 8 days. This means they can be administered to the patient relatively quickly. This treatment is compared with the current standard third-line treatment. That is systemic therapy with:
pomalidomide, cyclophosphamide, and dexamethasone (PEP);
pomalidomide, bortezomib, and dexamethasone (PVd);
carfilzomib and dexamethasone (Kd);
elotuzumab, pomalidomide, and dexamethasone (EPd); or
daratumumab, carfilzomib, and dexamethasone (DKd). The research
The study is a multicenter, open-label, randomized trial comparing the (cost) effectiveness of point-of-care BCMA-targeted CAR T-cell therapy with that of current standard treatment with systemic therapies. Systemic means that the medicines reach everywhere in the body. The study will enroll 126 patients with relapsed or refractory multiple myeloma who have received at least 2 systemic therapies. Recurrent means that the cancer has come back after having disappeared partially or completely. And refractory means that the tumor has not responded to previous treatment. 63 patients will receive site-of-care BCMA-targeted CAR T-cell therapy. The aim of this study is to discover whether this treatment leads to longer progression-free survival in the aforementioned patients, compared to the current standard treatment. Progression-free survival means that a patient lives with the disease, but it does not get worse. The hypothesis is that the average progression-free survival will increase from 9 to 16 months. The effects of BCMA-targeted CAR T-cell therapy produced at the point of care on other outcome measures, such as safety and cost-effectiveness, are also examined. The research is led by the University Medical Center Groningen (UMCG) in Groningen. Assessment of the state of science and practice
After completing the study and obtaining the research results, the Healthcare Institute will assess, based on all published research results within 6 months, whether BCMA-targeted CAR T-cell therapy produced at the care location in patients with relapsed or refractory multiple myeloma complies with the 'state of science and practice'. The Healthcare Institute also assesses whether the (additional) costs are acceptable. In this project, research is being conducted into an Advanced Therapy Medicinal Product (ATMP). An ATMP is a drug based on genes, cells or tissues. If the ATMP does not have a marketing authorization or does not yet have a marketing authorization, patients may only be treated with a so-called hospital exemption after the end of the study. This is a hospital exception. The Healthcare and Youth Inspectorate (IGJ) must first approve this. If the treatment leads to positive outcomes for patients, grant recipients should pursue ATMP registration. Currently, BCMA-targeted CAR T-cell therapy produced at the point of care in patients with relapsed or refractory multiple myeloma does not yet meet the 'state of the art and practice'. The treatment may therefore not yet be reimbursed from the basic health insurance package. For information
Do you have any questions? Then you can send this by e-mail to the Zorginstituut, Promising Care team: redactiezorg@zinl.nl. Planning
Duration Promising healthcare project
April 2031 - September 2031
Parties involved
HOVON
Hematon",3.35
