Advisory Topic,Standardized Cancer Type,Source URL,Scrape Date,Content Hash,Intro Summary,Full Context Block,Advisory Topic_en,Intro Summary_en,Full Context Block_en,trustworthiness
Evaluatie standpunt AFT na een totale borstverwijdering,Algemeen / Onbekend,https://www.zorginstituutnederland.nl/werkagenda/kanker/evaluatie-standpunt-aft-na-een-totale-borstverwijdering,2026-05-31 14:45:41,6036d93ddc73cc055b97bd4abbd540487ff58757b7457066c7d54bfb675f23d1,"Zorginstituut Nederland evalueert de toepassing van het standpunt AFT na een totale borstverwijdering voor een bepaalde groep vrouwen. AFT staat voor autologe vettransplantatie met externe weefselexpansie. Hierbij evalueert het Zorginstituut de passende organisatie en inzet van AFT bij deze patiëntengroep, volgens de afspraken in het standpunt en het bijbehorende waarborgendocument.","Zorginstituut Nederland evalueert de toepassing van het standpunt AFT na een totale borstverwijdering voor een bepaalde groep vrouwen. AFT staat voor autologe vettransplantatie met externe weefselexpansie. Hierbij evalueert het Zorginstituut de passende organisatie en inzet van AFT bij deze patiëntengroep, volgens de afspraken in het standpunt en het bijbehorende waarborgendocument.
Standpunt AFT na een totale borstverwijdering
In januari 2023 bracht het Zorginstituut het standpunt AFT na een totale borstverwijdering uit . Hierin concludeert het Zorginstituut dat AFT voldoet aan ‘de stand van de wetenschap en praktijk’ bij vrouwen die een borst moeten laten verwijderen door borstkanker of om borstkanker te voorkomen. Om passende zorg voor deze patiënten te kunnen garanderen, heeft het Zorginstituut een waarborgendocument ontwikkeld, samen met de beroepsgroep van plastische chirurgen, patiëntvertegenwoordigers en zorgverzekeraars. Het gaat over de volgende onderwerpen:
dataregistratie;
ontwikkelen van informatie voor samen beslissen;
opzetten van een scholingsprogramma;
doorontwikkeling van richtlijnen voor samen beslissen.
De vergoeding van AFT is op 1 januari 2023 ingegaan.
Evaluatievragen en voortgang
Op basis van het standpunt en het waarborgendocument hebben we 9 evaluatievragen opgesteld. In mei 2024 hebben we een voortgangsmeting uitgevoerd en in mei 2025 hebben we onderzocht hoe AFT in de praktijk werkt. Daarvoor keken we naar eigen registratiedata van de NVPC en declaratiedata van de zorgverzekeraars. Een beschrijving van de resultaten van beide metingen staat in de tabel op deze webpagina.
Voortgang evaluatievragen
1
Is er een registratie beschikbaar van patiënten die een borstreconstructie middels AFT hebben ondergaan?
2
Is er schriftelijke patiënteninformatie en een keuzehulp ontwikkeld?
Er is een keuzehulp en folder ontwikkeld door NVPC en BVN. In 2025 is een nieuwe folder gepubliceerd, maar nog niet gedeeld met de BVN. Het Zorginstituut zal navraag doen bij de BVN. De NVPC merkt op dat patiënten beter geïnformeerd naar de poli komen. Patiënten die daar behoefte aan hebben, krijgen ook een aanspreekpunt bij een ervaringsdeskundige via het ziekenhuis.
De BVN ziet graag dat de patiënteninformatie nog duidelijker de intensiteit van de operatie, het optreden van littekens en het aantal operaties beschrijft. De BVN zal een voorstel doen voor aanpassing van de patiënteninformatie.
3
Is de richtlijnmodule autologe vettransplantatie bij borstreconstructie na ablatio of borstsparende therapie herzien?
De richtlijnmodule wordt herzien en zal naar verwachting eind 2025 worden gepubliceerd worden. De richtlijnmodule is onderdeel van de richtlijn Borstkanker en er zal vanuit de richtlijn Borstreconstructie worden verwezen naar de module.
4
Is er een scholing voor professionals rondom totale borstreconstructie middels AFT georganiseerd?
Er is een fysieke en een online cursus beschikbaar voor plastisch chirurgen die voor plastisch chirurgen die de AFT-interventie uitvoeren of gaan uitvoeren. Tot en met 2028 blijft de online cursus alleen toegankelijk voor deze groep. Daarna wordt de cursus openbaar beschikbaar voor alle plastisch chirurgen in Nederland.
De BVN wordt door de NVPC uitgenodigd om feedback te geven op de online module om zo het patiëntperspectief te borgen. De module is geëvalueerd en aangepast op basis van feedback van chirurgen.
5",Evaluation of the AFT position after total breast removal,"The Dutch Healthcare Institute is evaluating the application of the AFT position after total breast removal for a specific group of women. AFT stands for autologous fat grafting with external tissue expansion. The Healthcare Institute evaluates the appropriate organization and deployment of AFT for this patient group, in accordance with the agreements in the position and the associated guarantees document.","The Dutch Healthcare Institute is evaluating the application of the AFT position after total breast removal for a specific group of women. AFT stands for autologous fat grafting with external tissue expansion. The Healthcare Institute evaluates the appropriate organization and deployment of AFT for this patient group, in accordance with the agreements in the position and the associated guarantees document.
Position of AFT after total breast removal
In January 2023, the Healthcare Institute published the AFT position after a total breast removal. The Healthcare Institute concludes that AFT complies with 'the state of science and practice' for women who need to have a breast removed due to breast cancer or to prevent breast cancer. To guarantee appropriate care for these patients, the Healthcare Institute has developed a guarantee document, together with the professional group of plastic surgeons, patient representatives and health insurers. It concerns the following topics:
data recording;
developing information for shared decision-making;
setting up a training program;
further development of guidelines for joint decision-making.
AFT's compensation took effect on January 1, 2023.
Evaluation questions and progress
Based on the position and the safeguards document, we have drawn up 9 evaluation questions. We carried out a progress measurement in May 2024 and in May 2025 we investigated how AFT works in practice. To do this, we looked at the NVPC's own registration data and declaration data from the health insurers. A description of the results of both measurements can be found in the table on this web page.
Progress evaluation questions
1
Is there a registration available of patients who have undergone breast reconstruction using AFT?
2
Has written patient information and a decision aid been developed?
A selection aid and brochure have been developed by NVPC and BVN. A new brochure was published in 2025, but has not yet been shared with the BVN. The Healthcare Institute will inquire with the BVN. The NVPC notes that patients come to the clinic better informed. Patients who need this will also have a point of contact with an expert through the hospital.
The BVN would like to see patient information describe more clearly the intensity of the operation, the occurrence of scars and the number of operations. The BVN will make a proposal for adjusting the patient information.
3
Has the guideline module for autologous fat grafting in breast reconstruction after ablation or breast-conserving therapy been revised?
The guideline module is being revised and is expected to be published at the end of 2025. The guideline module is part of the Breast Cancer guideline and reference will be made to the module from the Breast Reconstruction guideline.
4
Has training been organized for professionals regarding total breast reconstruction using AFT?
There is a physical and an online course available for plastic surgeons who are performing or will be performing the AFT intervention. Until 2028, the online course will only be accessible to this group. The course will then become publicly available to all plastic surgeons in the Netherlands.
The BVN is invited by the NVPC to provide feedback on the online module in order to safeguard the patient perspective. The module has been evaluated and adjusted based on feedback from surgeons.
5",3.35
Evaluatie standpunt Ductoscopie bij pathologische tepeluitvloed,Algemeen / Onbekend,https://www.zorginstituutnederland.nl/werkagenda/kanker/evaluatie-standpunt-ductoscopie-bij-pathologische-tepeluitvloed,2026-05-31 14:45:43,868be5de8688b86bd7c499c3043296d8d1c72d3e089a7993d785d146164296c3,"Zorginstituut Nederland evalueert de toepassing van het standpunt Ductoscopie bij pathologische tepeluitvloed. Hierbij evalueert het Zorginstituut de passende organisatie en inzet van ductoscopie, volgens de afspraken in het standpunt en het bijbehorende waarborgendocument.","Zorginstituut Nederland evalueert de toepassing van het standpunt Ductoscopie bij pathologische tepeluitvloed. Hierbij evalueert het Zorginstituut de passende organisatie en inzet van ductoscopie, volgens de afspraken in het standpunt en het bijbehorende waarborgendocument.
Standpunt Ductoscopie bij pathologische tepeluitvloed
Op 13 december 2022 bracht het Zorginstituut het standpunt Ductoscopie bij pathologische tepeluitvloed uit. Hierin concludeert het Zorginstituut dat ductoscopie bij pathologische tepeluitvloed voldoet aan ‘de stand van wetenschap en praktijk’. Het gaat om tepeluitvloed die langer dan 3 maanden duurt, zonder dat daar een duidelijke verklaring voor is. Hierbij is uit een mammografie (röntgenfoto van de borst) of echografie (onderzoek dat geluidsgolven omzet naar beeld) geen kwaadaardige tumor gebleken. Om gepast gebruik te bevorderen van deze behandeling, heeft de beroepsgroep in samenwerking met Zorgverzekeraars Nederland (ZN) een waarborgendocument met kwaliteitsafspraken opgesteld.
Deze kwaliteitsafspraken gaan over:
indicatiecriteria
ontwikkelen van informatie voor samen beslissen
kwaliteitscriteria behandelaars en behandelcentra
concentratie van zorg
opzetten van een scholingsprogramma
onderzoek naar de effectiviteit en veiligheid van de behandeling in de praktijk.
De vergoeding van ductoscopie is op 13 december 2022 ingegaan.
Evaluatievragen en voortgang
Op basis van het standpunt en het waarborgendocument hebben we 13 evaluatievragen opgesteld. In 2025 deden we een voortgangsmeting om de evaluatievragen kwalitatief te onderzoeken. Hiervoor namen we contact op met onze contactpersonen van de Nederlandse Vereniging voor Heelkunde (NVvH) sectie Nederlandse Vereniging voor Chirurgische Oncologie (NVCO), Borstkankervereniging Nederland (BVN) en Zorgverzekeraars Nederland (ZN). De voortgang van de evaluatievragen bespraken we in een overleg met de NVvH in september 2025. In het overleg werd duidelijk dat de implementatie van ductoscopie nog niet op gang is: de behandeling op dit moment namelijk alleen uitgevoerd door 1 chirurg-oncoloog in het UMC Utrecht.
Antwoord volgt bij de effectmeting.
Huidige stand van zaken: de NVvH geeft aan dat ductoscopie soms buiten de indicatiecriteria wordt toegepast. Het is aantrekkelijk deze procedure uit te voeren, aangezien het een dure chirurgische ingreep kan voorkomen. De slagingskans van ductoscopie neemt volgens de NVvH wel af als het buiten de indicatiecriteria wordt toegepast.
Antwoord volgt bij de effectmeting.
Huidige stand van zaken: op dit moment voert alleen het UMC Utrecht ductoscopie uit.
Planning van de evaluatie
We doen in 2026 een effectmeting waarin we de toepassing van ductoscopie in de praktijk kwantitatief onderzoeken. Dit doen we op basis van declaratiedata en de eigen registratiedata van de NVvH, als die beschikbaar zijn. Daarna organiseren we een bijeenkomst met de betrokken partijen om de resultaten te bespreken. Afhankelijk van de bevindingen doen we nog een effectmeting op een later moment. De evaluatievraag over de volumenorm (vraag 12) evalueren we kwantitatief, als de data beschikbaar is over 3 opeenvolgende jaren waarin ductoscopie is geïmplementeerd. We publiceren de resultaten van de effectmetingen op deze webpagina. Na de laatste effectmeting publiceren we een beknopt evaluatierapport en sluiten daarmee de evaluatie af.
Betrokken partijen
Nederlandse Vereniging voor Heelkunde (NVvH), sectie Nederlandse Vereniging voor Chirurgische Oncologie (NVCO)
Borstkankervereniging Nederland (BVN)
Zorgverzekeraars Nederland (ZN)
Meer informatie of vragen?
Hebt u vragen over deze evaluatie? Mail uw vraag dan via ons contactformulier .",Evaluation position Ductoscopy in pathological nipple discharge,"The Dutch Healthcare Institute evaluates the application of the Ductoscopy position in pathological nipple discharge. The Healthcare Institute evaluates the appropriate organization and use of ductoscopy, in accordance with the agreements in the position and the associated guarantees document.","The Dutch Healthcare Institute evaluates the application of the Ductoscopy position in pathological nipple discharge. The Healthcare Institute evaluates the appropriate organization and use of ductoscopy, in accordance with the agreements in the position and the associated guarantees document.
Position Ductoscopy in pathological nipple discharge
On December 13, 2022, the Healthcare Institute published its position Ductoscopy for pathological nipple discharge. The Healthcare Institute concludes that ductoscopy for pathological nipple discharge complies with 'the state of science and practice'. This concerns nipple discharge that lasts longer than 3 months, without a clear explanation. A mammography (X-ray of the breast) or ultrasound (examination that converts sound waves into images) has not revealed any malignant tumor. To promote appropriate use of this treatment, the professional group has drawn up a guarantee document with quality agreements in collaboration with Zorgverzekeraars Nederland (ZN).
These quality agreements concern:
indication criteria
developing information for shared decision-making
quality criteria for practitioners and treatment centers
concentration of care
setting up a training program
research into the effectiveness and safety of the treatment in practice.
The reimbursement for ductoscopy came into effect on December 13, 2022.
Evaluation questions and progress
Based on the position and the safeguards document, we have drawn up 13 evaluation questions. In 2025 we carried out a progress measurement to qualitatively investigate the evaluation questions. For this purpose, we contacted our contact persons at the Dutch Association for Surgery (NVvH) section, Dutch Association for Surgical Oncology (NVCO), Breast Cancer Association Netherlands (BVN) and Health Insurers Netherlands (ZN). We discussed the progress of the evaluation questions in a meeting with the NVvH in September 2025. During the meeting it became clear that the implementation of ductoscopy is not yet underway: the treatment is currently only carried out by 1 surgical oncologist at the UMC Utrecht.
An answer will follow during the effect measurement.
Current state of affairs: the NVvH indicates that ductoscopy is sometimes used outside the indication criteria. It is attractive to perform this procedure as it can avoid an expensive surgical procedure. According to the NVvH, the chance of success of ductoscopy decreases if it is used outside the indication criteria.
An answer will follow during the effect measurement.
Current state of affairs: currently only the UMC Utrecht performs ductoscopy.
Planning the evaluation
We will conduct an effect measurement in 2026 in which we will quantitatively investigate the application of ductoscopy in practice. We do this on the basis of declaration data and the NVvH's own registration data, if available. We will then organize a meeting with the parties involved to discuss the results. Depending on the findings, we will carry out an effect measurement at a later time. We evaluate the evaluation question about the volume standard (question 12) quantitatively, if the data is available for 3 consecutive years in which ductoscopy has been implemented. We publish the results of the effect measurements on this web page. After the last effect measurement, we will publish a concise evaluation report and thus conclude the evaluation.
Parties involved
Dutch Society for Surgery (NVvH), section Dutch Society for Surgical Oncology (NVCO)
Breast Cancer Association Netherlands (BVN)
Health insurers Netherlands (ZN)
More information or questions?
Do you have any questions about this evaluation? Please email your question via our contact form.",3.35
Evaluatie standpunt MammaPrint en Oncotype DX vergoede zorg voor bepaalde groep vrouwen,Borstkanker (Breast),https://www.zorginstituutnederland.nl/werkagenda/kanker/evaluatie-standpunt-mammaprint-en-oncotype-dx-vergoede-zorg-voor-bepaalde-groep-vrouwen,2026-05-31 14:45:45,6ef7c56eb223441b02bdac8ff46bdb619422506be04da9923d17228cd795c57d,Zorginstituut Nederland evalueert de toepassing van het standpunt Mammaprint en Oncotype DX vergoede zorg voor een bepaalde groep vrouwen.,"Zorginstituut Nederland evalueert de toepassing van het standpunt Mammaprint en Oncotype DX vergoede zorg voor een bepaalde groep vrouwen.
Standpunt MammaPrint en Oncotype DX vergoede zorg voor bepaalde groep vrouwen
Op 24 oktober 2023 bracht het Zorginstituut het standpunt Mammaprint en Oncotype DX vergoede zorg voor bepaalde groep vrouwen uit. Hierin concludeert het Zorginstituut dat MammaPrint® en Oncotype DX® vergoed kunnen worden uit het basispakket van de zorgverzekering. Dit geldt voor een kleine groep vrouwen vanaf 50 jaar met borstkanker in een vroeg stadium, bij wie twijfel is of zij baat zullen hebben bij aanvullende chemotherapie. Door inzet van deze zogeheten genexpressietesten kan een deel van de vrouwen afzien van aanvullende chemotherapie. Om passende zorg te garanderen, zijn er afspraken gemaakt met partijen over de gepaste inzet van de Oncotype DX® en de MammaPrint®. De afspraken gaan over de volgende onderwerpen:
indicatiecriteria
ontwikkelen van informatie voor samen beslissen
herziening van de behandelrichtlijn.
Evaluatievragen en voortgang
Op basis van het standpunt en de afspraken hebben we 6 evaluatievragen opgesteld. De vragen staan in de tabel met een beschrijving van de resultaten van de eerste voortgangsmeting in april 2025.
Is de cluster Borstkanker van de richtlijnmodule up-to-date?
Antwoord volgt bij de eerste effectmeting.
Huidige stand van zaken: BVN heeft samen met de Hogeschool van Utrecht een enquête uitgevoerd over de inzet van de genexpressietesten in 30 ziekenhuizen. Hieruit blijkt dat het gebruik van de genexpressietesten aanzienlijk lager is dan de raming. Naar schatting wordt maar 30% van de groep die in aanmerking komt daadwerkelijk getest. Ook liet het onderzoek grote verschillen zien tussen ziekenhuizen in het gebruik van de testen.
Antwoord volgt bij de eerste effectmeting.
Huidige stand van zaken: de testen worden volgens NABON alleen gebruikt bij patiënten die voldoen aan de indicatiecriteria. De inzet gebeurt op basis van medische overwegingen én de wens van de patiënt. Er zijn geen signalen dat patiënten buiten de criteria worden getest.
Antwoord volgt bij de eerste effectmeting.
Huidige stand van zaken: de betrokken partijen geven aan dat de genexpressietesten worden gebruikt als aanvulling op de standaard risicoschatting. Er zijn geen signalen over de inzet van meerdere testen per tumor.
Planning en aanpak van de evaluatie
In 2025 doen we een voortgangsmeting om de evaluatievragen kwalitatief te onderzoeken. Hiervoor nemen we contact op met onze contactpersonen van Borstkankervereniging Nederland (BVN), Nationaal Borstkanker Overleg Nederland (NABON), Nederlandse Vereniging voor Medisch Oncologie (NVMO), Nederlandse Vereniging voor Pathologie (NVvP) en Zorgverzekeraars Nederland (ZN).
Ook doen we in 2026 een effectmeting, waarin we de toepassing van Mammaprint en Oncotype DX in de praktijk kwantitatief onderzoeken. Dit doen we op basis van de registratiedata (indien beschikbaar) en declaratiedata. Na de effectmeting organiseren we een bijeenkomst met de betrokken veldpartijen om de resultaten te duiden. Afhankelijk van de bevindingen herhalen we de effectmeting. We publiceren de resultaten van de voortgangsmetingen en de tussentijdse effectmetingen op deze webpagina. Na de laatste effectmeting publiceren we een beknopt evaluatierapport en sluiten daarmee de evaluatie af.
Meer informatie of vragen?
Hebt u vragen over deze evaluatie? Mail uw vraag dan via ons contactformulier .",Evaluation of MammaPrint and Oncotype DX's position on reimbursed care for a certain group of women,The Dutch Healthcare Institute is evaluating the application of the Mammaprint and Oncotype DX position on reimbursed care for a specific group of women.,"The Dutch Healthcare Institute is evaluating the application of the Mammaprint and Oncotype DX position on reimbursed care for a specific group of women.
Position of MammaPrint and Oncotype DX on reimbursed care for certain groups of women
On October 24, 2023, the Healthcare Institute published the Mammaprint and Oncotype DX position on reimbursed care for a certain group of women. The Healthcare Institute concludes that MammaPrint® and Oncotype DX® can be reimbursed from the basic health insurance package. This applies to a small group of women aged 50 and over with early-stage breast cancer, for whom there is doubt whether they will benefit from additional chemotherapy. By using these so-called gene expression tests, some women can opt out of additional chemotherapy. To guarantee appropriate care, agreements have been made with parties about the appropriate use of the Oncotype DX® and the MammaPrint®. The agreements concern the following topics:
indication criteria
developing information for shared decision-making
revision of the treatment guideline.
Evaluation questions and progress
Based on the position and agreements, we have drawn up 6 evaluation questions. The questions are in the table describing the results of the first progress measurement in April 2025.
Is the Breast Cancer cluster of the guideline module up to date?
An answer will follow during the first effect measurement.
Current state of affairs: BVN, together with the Utrecht University of Applied Sciences, conducted a survey on the use of gene expression tests in 30 hospitals. This shows that the use of gene expression tests is considerably lower than the estimate. It is estimated that only 30% of the eligible group is actually tested. The study also showed major differences between hospitals in the use of the tests.
An answer will follow during the first effect measurement.
Current state of affairs: according to NABON, the tests are only used in patients who meet the indication criteria. The use is based on medical considerations and the wishes of the patient. There are no signals that patients are being tested outside the criteria.
An answer will follow during the first effect measurement.
Current state of affairs: the parties involved indicate that the gene expression tests are used as a supplement to the standard risk assessment. There are no signals about the use of multiple tests per tumor.
Planning and approach to the evaluation
We will conduct a progress measurement in 2025 to qualitatively investigate the evaluation questions. For this purpose, we contact our contact persons at the Dutch Breast Cancer Association (BVN), the National Breast Cancer Consultation of the Netherlands (NABON), the Dutch Association for Medical Oncology (NVMO), the Dutch Association for Pathology (NVvP) and the Dutch Health Insurers (ZN).
We will also conduct an effect measurement in 2026, in which we will quantitatively investigate the application of Mammaprint and Oncotype DX in practice. We do this based on the registration data (if available) and declaration data. After the effect measurement, we organize a meeting with the field parties involved to explain the results. Depending on the findings, we repeat the effect measurement. We publish the results of the progress measurements and the interim effect measurements on this web page. After the last effect measurement, we will publish a concise evaluation report and thus conclude the evaluation.
More information or questions?
Do you have any questions about this evaluation? Please email your question via our contact form.",3.35
