Advisory Topic,Standardized Cancer Type,Source URL,Scrape Date,Content Hash,Intro Summary,Full Context Block,Advisory Topic_en,Intro Summary_en,Full Context Block_en,trustworthiness
Advies - herbeoordeling kosteneffectiviteit ciltacabtagene autoleucel (Carvykti®) voor de behandeling van multipel myeloom,Algemeen / Onbekend,https://www.zorginstituutnederland.nl/werkagenda/kanker/pakketadvies-sluisgeneesmiddel-ciltacabtagene-autoleucel-carvykti-bij-multipel-myeloom,2026-05-31 14:45:59,2a2f9073403adac0bad9de742f2baca5f6c4b390d5cbab64438c067965562f86,"Zorginstituut Nederland beoordeelt voor welke prijs ciltacabtagene autoleucel (cilta-cel; Carvykti®) kan worden vergoed. Dit medicijn kan worden gebruikt voor bepaalde patiënten met multipel myeloom. Cilta-cel is een sluisgeneesmiddel. Vanwege de te verwachten hoge kosten heeft de minister van Volksgezondheid, Welzijn en Sport (VWS) het medicijn voor bepaalde patiënten in de ‘sluis voor dure geneesmiddelen’ geplaatst. In februari 2025 adviseerden wij de minister al om cilta-cel na prijsonderhandelingen te vergoeden. De minister heeft nog geen akkoord bereikt over de prijs. Sinds het advies van februari 2025 zijn nieuwe gegevens beschikbaar gekomen over cilta-cel. De registratiehouder vraagt daarom nu om een herbeoordeling van de kosteneffectiviteit van cilta-cel.","Zorginstituut Nederland beoordeelt voor welke prijs ciltacabtagene autoleucel (cilta-cel; Carvykti®) kan worden vergoed. Dit medicijn kan worden gebruikt voor bepaalde patiënten met multipel myeloom. Cilta-cel is een sluisgeneesmiddel. Vanwege de te verwachten hoge kosten heeft de minister van Volksgezondheid, Welzijn en Sport (VWS) het medicijn voor bepaalde patiënten in de ‘sluis voor dure geneesmiddelen’ geplaatst. In februari 2025 adviseerden wij de minister al om cilta-cel na prijsonderhandelingen te vergoeden. De minister heeft nog geen akkoord bereikt over de prijs. Sinds het advies van februari 2025 zijn nieuwe gegevens beschikbaar gekomen over cilta-cel. De registratiehouder vraagt daarom nu om een herbeoordeling van de kosteneffectiviteit van cilta-cel.
Cilta-cel is bedoeld voor bepaalde mensen met multipel myeloom
Cilta-cel is een CAR-T-behandeling. Een CAR-T-behandeling verschilt van gebruikelijk behandelingen voor multipel myeloom. Tijdens een CAR-T-behandeling worden lichaamseigen immuuncellen van een patiënt zo geprogrammeerd, dat deze zich keren tegen de tumorcellen. Deze CAR-T-behandeling, cilta-cel, heeft als merknaam Carvykti®. Het medicijn is een eenmalige gentherapie.
Het medicijn kan worden gebruikt bij mensen met multipel myeloom. Bij multipel myeloom is sprake van een ongecontroleerde deling van kwaadaardige plasmacellen in het beenmerg. Plasmacellen zijn witte bloedcellen die antistoffen maken. Beenmerg is weefsel in de botten. Multipel myeloom wordt ook wel ‘de ziekte van Kahler’ genoemd. De fabrikant heeft de vergoeding aangevraagd voor volwassen patiënten met recidiverend of refractair multipel myeloom die ten minste 3 eerdere behandelingen hebben ondergaan, waaronder een proteasoomremmer, een immunomodulerend middel en een anti-CD38-antilichaam. Recidief betekent dat de kanker is teruggekomen, na eerst gedeeltelijk of geheel te zijn verdwenen. En refractair betekent dat de tumor niet op een eerdere behandeling heeft gereageerd.
Meer informatie voor professionals (in het Engels).
Eerder advies cilta-cel: vergoed cilta-cel na prijsdaling
Het Zorginstituut adviseerde de minister van VWS in februari 2025 al over cilta-cel (Carvykti®) voor de behandeling van bepaalde patiënten met multipel myeloom. Het advies was toen om het medicijn na prijsonderhandelingen te vergoeden uit het basispakket van de zorgverzekering. De behandeling kan worden vergoed als de fabrikant de vraagprijs minstens 35% laat zakken. De minister liet in november 2025 weten dat er geen akkoord over de prijs is bereikt met de registratiehouder van cilta-cel.
Uitleg over sluisgeneesmiddelen
De minister heeft cilta-cel voor inzet bij bepaalde patiënten met multipel myeloom in de 'sluis voor dure geneesmiddelen' geplaatst. Geneesmiddelen die in het ziekenhuis worden gebruikt, noemen we intramurale geneesmiddelen. Nieuwe intramurale geneesmiddelen worden meestal zonder bijzondere afspraken over de prijs of het gebruik toegelaten tot het basispakket van de zorgverzekering. Als nieuwe middelen veel kosten, dan kan de minister van VWS besluiten om deze tijdelijk uit het basispakket te houden en in de ‘sluis voor dure geneesmiddelen’ plaatsen. Dit betekent dat het middel pas voor vergoeding uit het basispakket in aanmerking komt, als:
het Zorginstituut een positief pakketadvies heeft uitgebracht;
er afspraken zijn gemaakt voor gepast gebruik;
de minister een prijsonderhandeling heeft uitgevoerd.
Kijk voor meer uitleg op de pagina ‘Sluis voor dure geneesmiddelen’ .
Hoe ontstaat het advies?
De minister van Volksgezondheid, Welzijn en Sport (VWS) vraagt het Zorginstituut een beoordeling te doen. De Wetenschappelijke Adviesraad (WAR) adviseert het Zorginstituut bij de beoordeling. De minister neemt de uiteindelijke beslissing om het medicijn wel of niet te vergoeden uit het basispakket van de zorgverzekering.
Bekijk het filmpje voor meer uitleg over hoe wij de beoordeling van geneesmiddelen aanpakken.
Uitgeschreven tekst
[Zorginstituut Nederland]
Iedereen in Nederland betaalt mee aan de gezondheidszorg. Zorginstituut Nederland waakt erover dat die zorg goed én betaalbaar blijft.
Komt er bijvoorbeeld een nieuw medicijn op de markt, dan beoordelen wij of het vergoed moet worden uit het basispakket. We geven daarover advies aan de minister voor Medische Zorg.
Die beoordeling gaat zo: Als een medicijn is goedgekeurd kan de fabrikant een aanvraag bij ons doen voor toelating tot het basispakket. Zodra we alle informatie en wetenschappelijke onderzoeken hebben ontvangen, gaan we aan de slag. We beantwoorden vragen als:
Hoe ernstig is de ziekte?
Hoe goed werkt het medicijn?
Bij welke groep patiënten?
En, wat kost het ten opzichte van wat het oplevert voor de patiënt?",Advice - reassessment of cost-effectiveness of ciltacabtagene autoleucel (Carvykti®) for the treatment of multiple myeloma,"The Dutch Healthcare Institute assesses at what price ciltacabtagene autoleucel (cilta-cel; Carvykti®) can be reimbursed. This drug may be used for certain patients with multiple myeloma. Cilta-cel is a lock drug. Due to the expected high costs, the Minister of Health, Welfare and Sport (VWS) has placed the medicine in the 'expensive medicines lock' for certain patients. In February 2025, we already advised the minister to reimburse Cilta-cel after price negotiations. The minister has not yet reached an agreement on the price. Since the February 2025 advice, new data have become available about cilta-cel. The marketing authorization holder is therefore now requesting a reassessment of the cost-effectiveness of cilta-cel.","The Dutch Healthcare Institute assesses at what price ciltacabtagene autoleucel (cilta-cel; Carvykti®) can be reimbursed. This drug may be used for certain patients with multiple myeloma. Cilta-cel is a lock drug. Due to the expected high costs, the Minister of Health, Welfare and Sport (VWS) has placed the medicine in the 'expensive medicines lock' for certain patients. In February 2025, we already advised the minister to reimburse Cilta-cel after price negotiations. The minister has not yet reached an agreement on the price. Since the February 2025 advice, new data have become available about cilta-cel. The marketing authorization holder is therefore now requesting a reassessment of the cost-effectiveness of cilta-cel. Cilta-cel is intended for certain people with multiple myeloma
Cilta-cel is a CAR-T treatment. CAR-T treatment differs from usual treatments for multiple myeloma. During CAR-T treatment, a patient's own immune cells are programmed in such a way that they turn against the tumor cells. This CAR-T treatment, cilta-cel, has the brand name Carvykti®. The drug is a one-time gene therapy. The drug can be used in people with multiple myeloma. Multiple myeloma involves the uncontrolled division of malignant plasma cells in the bone marrow. Plasma cells are white blood cells that produce antibodies. Bone marrow is tissue in the bones. Multiple myeloma is also called 'Kahler's disease'. The manufacturer has applied for reimbursement for adult patients with relapsed or refractory multiple myeloma who have received at least 3 prior treatments, including a proteasome inhibitor, an immunomodulatory agent and an anti-CD38 antibody. Recurrence means that the cancer has come back after having disappeared partially or completely. And refractory means that the tumor has not responded to previous treatment. More information for professionals (in English). Previous advice on cilta-cel: reimburse cilta-cel after price drop
The Healthcare Institute already advised the Minister of Health, Welfare and Sport in February 2025 about cilta-cel (Carvykti®) for the treatment of certain patients with multiple myeloma. The advice at the time was to reimburse the medicine from the basic health insurance package after price negotiations. The treatment can be reimbursed if the manufacturer lowers the asking price by at least 35%. The minister announced in November 2025 that no agreement on the price had been reached with the registration holder of cilta-cel. Explanation of lock medicines
The minister has placed cilta-cel in the 'slot for expensive medicines' for use in certain patients with multiple myeloma. Medicines used in the hospital are called inpatient medicines. New intramural medicines are usually admitted to the basic health insurance package without special agreements on price or use. If new medicines cost a lot, the Minister of Health, Welfare and Sport can decide to temporarily keep them out of the basic package and place them in the 'lock for expensive medicines'. This means that the drug is only eligible for reimbursement from the basic package if:
the Healthcare Institute has issued a positive package advice;
agreements have been made for appropriate use;
the minister has conducted a price negotiation. For more information, see the 'Fluid for expensive medicines' page. How is the advice created? The Minister of Health, Welfare and Sport (VWS) asks the Healthcare Institute to conduct an assessment. The Scientific Advisory Council (WAR) advises the Healthcare Institute on the assessment. The minister makes the final decision whether or not to reimburse the medicine from the basic health insurance package. Watch the video for more explanation about how we approach the assessment of medicines. Transcribed text
[Netherlands Healthcare Institute]
Everyone in the Netherlands contributes to healthcare. The Dutch Healthcare Institute ensures that this care remains good and affordable. For example, if a new medicine comes onto the market, we will assess whether it should be reimbursed from the basic package. We provide advice on this to the Minister for Medical Care. The assessment goes like this: If a medicine has been approved, the manufacturer can submit an application to us for admission to the basic package. Once we have received all the information and scientific research, we will get to work. We answer questions such as:
How serious is the disease? How well does the medicine work? In which group of patients? And what does it cost compared to what it yields for the patient?",3.35
Advies - wel of niet vergoeden daratumumab (Darzalex®) voor de behandeling van multipel myeloom,Algemeen / Onbekend,https://www.zorginstituutnederland.nl/werkagenda/kanker/pakketadvies-sluisgeneesmiddel-daratumumab-darzalex-bij-multipel-myeloom,2026-05-31 14:46:02,7539a8626cfd34c3bfe773b720043b41ec97f90a8467ad09e72b89276eb0ad31,"Zorginstituut Nederland beoordeelt of daratumumab (Darzalex®) in combinatie met bortezomib, lenalidomide en dexamethason vergoed kan worden. Deze combinatie van medicijnen kan worden gebruikt voor bepaalde patiënten met multipel myeloom. Daratumumab is een sluisgeneesmiddel. Vanwege de te verwachten hoge kosten heeft de minister van Volksgezondheid, Welzijn en Sport (VWS) het medicijn voor gebruik bij genoemde patiënten in de ‘sluis voor dure geneesmiddelen’ geplaatst.","Zorginstituut Nederland beoordeelt of daratumumab (Darzalex®) in combinatie met bortezomib, lenalidomide en dexamethason vergoed kan worden. Deze combinatie van medicijnen kan worden gebruikt voor bepaalde patiënten met multipel myeloom. Daratumumab is een sluisgeneesmiddel. Vanwege de te verwachten hoge kosten heeft de minister van Volksgezondheid, Welzijn en Sport (VWS) het medicijn voor gebruik bij genoemde patiënten in de ‘sluis voor dure geneesmiddelen’ geplaatst.
Daratumumab is bedoeld voor bepaalde mensen met multipel myeloom
Daratumumab is de werkzame stof. De merknaam is Darzalex®. Het medicijn is een injectie.
Het medicijn kan worden gebruikt bij mensen met multipel myeloom. Multipel myeloom, ook wel de ziekte van Kahler genoemd, is een kanker van plasmacellen. Plasmacellen zijn 1 van de soorten afweercellen van het menselijk lichaam. Myeloomcellen is een ander woord voor kwaadaardige plasmacellen. Er vindt bij multipel myeloom ongecontroleerde celdeling plaats van kwaadaardige plasmacellen, op meerdere plekken in het beenmerg. De fabrikant heeft de vergoeding aangevraagd voor volwassen patiënten met nieuw gediagnosticeerde multipel myeloom.
De volledige indicatie voor vergoeding en gebruik is te lezen in het uitklapmenu.
Volledige indicatie voor vergoeding van daratumumab
Daratumumab is in combinatie met bortezomib, lenalidomide en dexamethason geïndiceerd voor de behandeling van volwassen patiënten met nieuw gediagnosticeerd multipel myeloom. De fabrikant heeft enkel vergoeding aangevraagd voor patiënten die niet in aanmerking komen voor autologe stamceltransplantatie.
Meer informatie voor patiënten (Apotheek.nl) Meer informatie voor professionals (Farmacotherapeutisch Kompas)
Uitleg over sluisgeneesmiddelen
De minister heeft daratumumab voor inzet bij bepaalde patiënten met multipel myeloom in de 'sluis voor dure geneesmiddelen' geplaatst. Geneesmiddelen die in het ziekenhuis worden gebruikt, noemen we intramurale geneesmiddelen. Nieuwe intramurale geneesmiddelen worden meestal zonder bijzondere afspraken over de prijs of het gebruik toegelaten tot het basispakket van de zorgverzekering. Als nieuwe middelen veel kosten, dan kan de minister van VWS besluiten om deze tijdelijk uit het basispakket te houden en in de ‘sluis voor dure geneesmiddelen’ plaatsen. Dit betekent dat het middel pas voor vergoeding uit het basispakket in aanmerking komt, als:
het Zorginstituut een positief pakketadvies heeft uitgebracht;
er afspraken zijn gemaakt voor gepast gebruik;
de minister een prijsonderhandeling heeft uitgevoerd.
Kijk voor meer uitleg op de pagina ‘Sluis voor dure geneesmiddelen’ .
Hoe ontstaat het advies?
De minister van Volksgezondheid, Welzijn en Sport (VWS) vraagt het Zorginstituut een beoordeling te doen. De minister neemt de uiteindelijke beslissing om het medicijn wel of niet te vergoeden uit het basispakket van de zorgverzekering.
Bekijk het filmpje voor meer uitleg over hoe wij de beoordeling van geneesmiddelen aanpakken.
Uitgeschreven tekst
[Zorginstituut Nederland]
Iedereen in Nederland betaalt mee aan de gezondheidszorg. Zorginstituut Nederland waakt erover dat die zorg goed én betaalbaar blijft.
Komt er bijvoorbeeld een nieuw medicijn op de markt, dan beoordelen wij of het vergoed moet worden uit het basispakket. We geven daarover advies aan de minister voor Medische Zorg.
Die beoordeling gaat zo: Als een medicijn is goedgekeurd kan de fabrikant een aanvraag bij ons doen voor toelating tot het basispakket. Zodra we alle informatie en wetenschappelijke onderzoeken hebben ontvangen, gaan we aan de slag. We beantwoorden vragen als:
Hoe ernstig is de ziekte?
Hoe goed werkt het medicijn?
Bij welke groep patiënten?",Advice - whether or not to reimburse daratumumab (Darzalex®) for the treatment of multiple myeloma,"The Dutch Healthcare Institute assesses whether daratumumab (Darzalex®) in combination with bortezomib, lenalidomide and dexamethasone can be reimbursed. This combination of medications may be used for certain patients with multiple myeloma. Daratumumab is a lock drug. Due to the expected high costs, the Minister of Health, Welfare and Sport (VWS) has placed the medicine for use in the aforementioned patients in the 'lock for expensive medicines'.","The Dutch Healthcare Institute assesses whether daratumumab (Darzalex®) in combination with bortezomib, lenalidomide and dexamethasone can be reimbursed. This combination of medications may be used for certain patients with multiple myeloma. Daratumumab is a lock drug. Due to the expected high costs, the Minister of Health, Welfare and Sport (VWS) has placed the medicine for use in the aforementioned patients in the 'lock for expensive medicines'.
Daratumumab is intended for certain people with multiple myeloma
Daratumumab is the active substance. The brand name is Darzalex®. The medicine is an injection.
The drug can be used in people with multiple myeloma. Multiple myeloma, also called Kahler's disease, is a cancer of plasma cells. Plasma cells are one of the types of immune cells in the human body. Myeloma cells is another word for malignant plasma cells. In multiple myeloma, uncontrolled cell division of malignant plasma cells takes place in several places in the bone marrow. The manufacturer has applied for reimbursement for adult patients with newly diagnosed multiple myeloma.
The full indication for reimbursement and use can be read in the drop-down menu.
Full indication for reimbursement of daratumumab
Daratumumab in combination with bortezomib, lenalidomide and dexamethasone is indicated for the treatment of adult patients with newly diagnosed multiple myeloma. The manufacturer has only applied for reimbursement for patients who are not eligible for autologous stem cell transplantation.
More information for patients (Apotheek.nl) More information for professionals (Pharmacotherapeutisch Kompas)
Explanation of lock medicines
The minister has placed daratumumab in the 'slot for expensive medicines' for use in certain patients with multiple myeloma. Medicines used in the hospital are called inpatient medicines. New intramural medicines are usually admitted to the basic health insurance package without special agreements on price or use. If new medicines cost a lot, the Minister of Health, Welfare and Sport can decide to temporarily keep them out of the basic package and place them in the 'lock for expensive medicines'. This means that the drug is only eligible for reimbursement from the basic package if:
the Healthcare Institute has issued a positive package advice;
agreements have been made for appropriate use;
the minister has conducted a price negotiation.
For more information, see the 'Fluid for expensive medicines' page.
How is the advice created?
The Minister of Health, Welfare and Sport (VWS) asks the Healthcare Institute to conduct an assessment. The minister makes the final decision whether or not to reimburse the medicine from the basic health insurance package.
Watch the video for more explanation about how we approach the assessment of medicines.
Transcribed text
[Netherlands Healthcare Institute]
Everyone in the Netherlands contributes to healthcare. The Dutch Healthcare Institute ensures that this care remains good and affordable.
For example, if a new medicine comes onto the market, we will assess whether it should be reimbursed from the basic package. We provide advice on this to the Minister for Medical Care.
The assessment goes like this: If a medicine has been approved, the manufacturer can submit an application to us for admission to the basic package. Once we have received all the information and scientific research, we will get to work. We answer questions such as:
How serious is the disease?
How well does the medicine work?
In which group of patients?",3.35
